Title,Summary,Year
Beyond Binary Edits Robust Multimodal Knowledge Editing with Adversarial Subspace Alignment,"Multimodal large language models (MLLMs) need efficient mechanisms to update knowledge without degrading existing capabilities. While intrinsic multimodal knowledge editing achieves strong reliability and locality, it often exhibits limited generality, failing to propagate edits across semantically equivalent visual and linguistic variations. This issue arises from the lack of explicit semantic su… ▽ More Multimodal large language models (MLLMs) need efficient mechanisms to update knowledge without degrading existing capabilities. While intrinsic multimodal knowledge editing achieves strong reliability and locality, it often exhibits limited generality, failing to propagate edits across semantically equivalent visual and linguistic variations. This issue arises from the lack of explicit semantic supervision, rigid editing scopes, and biased anchoring to individual samples in high-dimensional multimodal spaces. We address robust intrinsic multimodal knowledge editing by explicitly targeting generalization. We formalize robustness through knowledge units that group semantically equivalent multimodal inputs and define generality as consistent predictions within each unit. To expose fragile semantic regions, we introduce Latent Adversarial Robustification (LAR), which generates adversarial yet semantically coherent variants in the joint latent space. We further propose Rank-Constrained Subspace Learning (RCSL), enforcing low-rank alignment of adversarial representations at the edit layer via a singular value-based objective. Extensive analysis demonstrates the effectiveness of ASAM empirically. △ Less",2026
Agentic Proving for Program Verification,"Agentic systems have recently emerged as state-of-the-art approaches for automated theorem proving in formal mathematics. To assess how far these capabilities extend to program verification, we evaluate Claude Code in an agentic proving framework on CLEVER, a Lean 4 benchmark for verifiable code generation. Our results show that Claude generates arguably valid specifications for 98.8% of problems… ▽ More Agentic systems have recently emerged as state-of-the-art approaches for automated theorem proving in formal mathematics. To assess how far these capabilities extend to program verification, we evaluate Claude Code in an agentic proving framework on CLEVER, a Lean 4 benchmark for verifiable code generation. Our results show that Claude generates arguably valid specifications for 98.8% of problems (with 81.3% also accepted by CLEVER's isomorphism-based scoring on the correct portion of the benchmark), certifies implementations against correct ground-truth specifications for 87.5% of problems, and reaches a 98.1% success rate on the end-to-end program generation and verification pipeline over entries with self-consistent premises. Across all stages, Claude further provides high-quality feedback on its own attempts (as confirmed under manual review), identifying underlying causes of failure and lingering bugs in the dataset. These findings highlight a growing mismatch between the difficulty of existing program verification benchmarks and the capabilities of modern agentic provers, and point to the need for more rigorous, bug-resilient evaluation methodologies, and in particular for alternatives to isomorphism-based scoring of generated specifications. More broadly, our results provide empirical evidence that tight compiler-in-the-loop agentic paradigms are currently the most effective approach for foundational program verification. △ Less",2026
PhotoFlow: Agentic 3D Virtual Photography Missions,"Virtual photography asks an agent to enter a prepared 3D scene with no preselected camera pose or reference image, infer a suitable shot from scene information and a language intent, choose executable camera parameters, and render the final photograph. Recent progress in vision-language models makes this kind of spatial agent increasingly plausible, but the task stresses two capabilities that rema… ▽ More Virtual photography asks an agent to enter a prepared 3D scene with no preselected camera pose or reference image, infer a suitable shot from scene information and a language intent, choose executable camera parameters, and render the final photograph. Recent progress in vision-language models makes this kind of spatial agent increasingly plausible, but the task stresses two capabilities that remain hard to evaluate together: complex 3D spatial understanding and abstract aesthetic judgment. We introduce PhotoFlow, a Director-Reviewer-Reflector agent for closed-loop camera search. The Director builds a soft photographic blueprint and proposes diverse candidate cameras; the Reviewer combines rule checks, visual critique, and pairwise incumbent selection; and the Reflector converts failures into region memory, dead-zone suppression, and high-explore relocation. We also introduce VPhotoBench, a benchmark of 47 open-license Blender scenes and 141 language-conditioned photography missions spanning subject placement, relational composition, and atmosphere/style. On held-out experiments, PhotoFlow achieves the strongest external quality-alignment composite and success rate among one-shot prediction, single-chain reflection, anchor-bank selection, and random search under a six-round rendering budget. To our knowledge, this is the first work to make language-conditioned virtual photography in arbitrary Blender scenes an executable agent task, and our results show that an LLM-centered spatial agent can already produce strong photographs in a setting designed to challenge both 3D reasoning and aesthetic choice. △ Less",2026
Revitalizing Dense Material Segmentation: Stabilized Vision Transformers and the Generalization Paradox,"…we demonstrate that material perception is far from solved and urge the community to leverage the rigorous original split to drive genuine progress in physically grounded artificial intelligence. ▽ More Material segmentation, the pixel-wise classification of physical surface properties, remains a challenging problem in computer vision, requiring physicochemical understanding distinct from object-centric parsing. Despite the introduction of the rigorous Apple Dense Material Segmentation (DMS) dataset, the benchmark has suffered from attrition and stagnation, increasingly overshadowed by geometry-biased foundation models. In this paper, we revive the Apple-DMS benchmark to establish a modern Vision Transformer baseline. We conduct an exhaustive evaluation of SegFormer and Mask2Former architectures, revealing that standard training paradigms fail on amorphous texture fields due to high-variance gradients. To address this, we introduce a stabilized training recipe featuring High-Fidelity Logit Projection, Query Entropy Regularization, and a domain-specific, physics-compliant augmentation pipeline. Our optimized SegFormer-B5 achieves a new State-of-the-Art (SOTA) of 0.4572 mIoU on the original dataset split, significantly surpassing the prior convolutional baseline. Furthermore, we identify a critical ""Generalization Paradox"": while re-partitioning the dataset into a data-rich 80/10/10 split inflates the metric to 0.5276 mIoU, expert qualitative analysis reveals this induces distributional homogenization, severely degrading real-world, out-of-distribution performance. By releasing our recovered dataset index and robust training framework, we demonstrate that material perception is far from solved and urge the community to leverage the rigorous original split to drive genuine progress in physically grounded artificial intelligence. △ Less",2026
Any2Any: Efficient Cross-Embodiment Transfer for Humanoid Whole-Body Tracking,"Whole-body tracking (WBT) models have become a key foundation for humanoid robots, enabling them to imitate diverse motions with high fidelity. Training such models from scratch requires large-scale data and computation, making rapid deployment on new humanoid platforms costly. This raises a natural question: Can pretrained WBT models transfer across embodiments with minimal adaptation? To answer… ▽ More Whole-body tracking (WBT) models have become a key foundation for humanoid robots, enabling them to imitate diverse motions with high fidelity. Training such models from scratch requires large-scale data and computation, making rapid deployment on new humanoid platforms costly. This raises a natural question: Can pretrained WBT models transfer across embodiments with minimal adaptation? To answer this question, we propose Any2Any, a paradigm that efficiently transfers an existing WBT specialist to a new humanoid embodiment with only a small amount of data and compute. Any2Any first performs kinematic alignment between source and target humanoids, aligning their input and output spaces so that the pretrained source policy can be meaningfully reused on the target embodiment.Any2Any then performs dynamics adaptation by applying lightweight parameter-efficient fine-tuning (PEFT) components to selected dynamics-sensitive modules, preserving useful behavioral priors while enabling targeted adaptation to the target robot. Extensive experiments on multiple humanoid platforms and pretrained backbones show that Any2Any substantially accelerates convergence and reduces training cost compared with training from scratch, while achieving competitive or superior tracking performance. Notably, using only 1% of the compute and data required for full training, Any2Any successfully transfers Sonic models pre-trained on Unitree G1 to LimX Oli and LimX Luna. These results suggest that pretrained WBT specialists can be efficiently reused across embodiments, providing a scalable path toward deploying humanoid whole-body control on new robots. △ Less",2026
MemAudit: Post-hoc Auditing of Poisoned Agent Memory via Causal Attribution and Structural Anomaly Detection,"Large language model agents increasingly rely on persistent memory to store past interactions, retrieve relevant demonstrations, and improve long-horizon task execution. However, this memory mechanism also creates a practical security vulnerability: an adversarial user may inject malicious records into the agent's memory through ordinary interaction, and these records can later be retrieved to ste… ▽ More Large language model agents increasingly rely on persistent memory to store past interactions, retrieve relevant demonstrations, and improve long-horizon task execution. However, this memory mechanism also creates a practical security vulnerability: an adversarial user may inject malicious records into the agent's memory through ordinary interaction, and these records can later be retrieved to steer the agent's reasoning and actions. Existing defenses primarily focus on online intervention, such as prompt filtering or output blocking, but they do not address the post-hoc question of which stored memories are responsible after harmful behavior has already been observed. We propose \textbf{MemAudit}, a post-hoc causal memory auditing framework for memory-augmented LLM agents. The framework combines two complementary signals: (1) a counterfactual memory influence score that measures each memory's causal contribution to harmful outputs, and (2) a memory consistency graph that identifies structurally anomalous memories within the broader memory store. We evaluate MemAudit against MINJA, a query-only memory injection attack in which malicious records are generated and stored through normal agent interactions rather than direct memory-bank modification. Across both QA and reasoning-agent settings, MemAudit substantially reduces attack success rates under realistic post-hoc auditing scenarios. The results show that QA attack success is reduced from $70\%$ to $0\%$, while RAP attack success drops from $83.3\%$ to $0\%$. △ Less",2026
Weierstrass Positional Encoding for Vision Transformers,"Vision Transformers have achieved remarkable success in computer vision, but their common use of learnable one-dimensional positional encodings weakens the inherent two-dimensional spatial structure of images after patch flattening. Existing positional encodings often lack geometric constraints and do not preserve a monotonic relationship between Euclidean spatial distances and sequential index di… ▽ More Vision Transformers have achieved remarkable success in computer vision, but their common use of learnable one-dimensional positional encodings weakens the inherent two-dimensional spatial structure of images after patch flattening. Existing positional encodings often lack geometric constraints and do not preserve a monotonic relationship between Euclidean spatial distances and sequential index distances, limiting ViTs' ability to exploit spatial proximity priors. Motivated by the usefulness of periodicity in positional encoding, we propose Weierstrass elliptic Positional Encoding (WePE), a mathematically grounded method for encoding two-dimensional coordinates in the complex domain. WePE maps normalized 2D patch coordinates onto the complex plane and constructs compact four-dimensional positional features using the Weierstrass elliptic function and its derivative. The double periodicity provides a principled representation of 2D positions, and its intrinsic lattice structure naturally matches the regular geometry of image patch grids. Its nonlinear geometric properties help model spatial distance relationships more faithfully, while the algebraic addition formula enables relative positional information between arbitrary patch pairs to be derived directly from their absolute encodings. WePE is plug-and-play and resolution-agnostic, allowing seamless integration into existing ViTs. Extensive experiments show that WePE brings consistent performance gains in most settings. With precomputed lookup tables, these improvements introduce no noticeable computational or memory overhead. Additional analyses and ablation studies further validate the effectiveness of the proposed method. △ Less",2026
OnePred: Next-Query Prediction via Recursive Intent Memory in Multi-Turn Conversations,"Although large language model (LLM) conversational systems process millions of multi-turn dialogues daily, they remain fundamentally reactive: they respond only after the user types a query. A key step toward proactive interaction is next-query prediction, which anticipates the user's subsequent query based solely on the preceding dialogue. Progress on this task is hindered by the lack of dedicate… ▽ More Although large language model (LLM) conversational systems process millions of multi-turn dialogues daily, they remain fundamentally reactive: they respond only after the user types a query. A key step toward proactive interaction is next-query prediction, which anticipates the user's subsequent query based solely on the preceding dialogue. Progress on this task is hindered by the lack of dedicated benchmarks and a fundamental efficiency--quality trade-off: naively concatenating full dialogue history incurs linearly growing token consumption, while truncating to the latest turn discards crucial cross-turn context. Our key insight is that accurate prediction does not require re-reading raw history; it suffices to track the user's evolving intent trajectory across topics, unresolved needs, and interest shifts. We propose OnePred, which maintains a recursively updated memory as its sole cross-turn context, bounding the per-turn cost independently of conversation length. We train the model via a two-stage reinforcement learning pipeline that first teaches what to predict, then what to compress, shaping the memory into a prediction-oriented intent chain. To establish a rigorous testbed, we introduce NQP-Bench, spanning three diverse subsets. Experiments demonstrate that OnePred reduces per-turn token consumption by up to 22$\times$ compared to full-history inputs while consistently exceeding all baselines in prediction quality, with larger gains on longer conversations. Our code is publicly available at https://github.com/ZBWpro/OnePred. △ Less",2026
A note on closed-form solutions for estimating sample size when externally validating a binary prediction model based on $C$-statistic precision,"…in R and Stata software via an iterative computational approach. We present seven novel closed-form solutions, derived using different computer algebra systems and artificial intelligence models, to the algebraic rearrangement of Newcombe's formula. We present these distinct forms to demonstrate how different compu… ▽ More External validation of clinical prediction models is crucial for assessing whether they are fit for use. The $C$-statistic is a widely used measure of discriminative performance of such models predicting a binary outcome. A method for obtaining the minimum sample size required for the precise estimation of the $C$-statistic during validation, based on the rearrangement of Newcombe's formula for the standard error of the $C$-statistic {SE($C$)}, was recently proposed and implemented in R and Stata software via an iterative computational approach. We present seven novel closed-form solutions, derived using different computer algebra systems and artificial intelligence models, to the algebraic rearrangement of Newcombe's formula. We present these distinct forms to demonstrate how different computational tools yield structurally distinct but mathematically equivalent solutions, and to evaluate their practical differences in computational performance. Our closed-form solutions yield identical sample size estimates to the iterative method when applied to illustrative examples. In a benchmarking analysis, the closed-form solutions were on average 148,000 to 264,000 times faster in median execution time than the current iterative implementation, while also exhibiting minor efficiency differences among themselves. This work provides a validated, highly efficient computational tool applicable to sample size calculation for external validation studies. R code functions implementing the closed-form solutions are provided. △ Less",2026
CVSearch: Empowering Multimodal LLMs with Cognitive Visual Search for High-Resolution Image Perception,"High-resolution (HR) image perception presents a key bottleneck for multimodal large language models (MLLMs). While visual search offers a promising solution, existing methods struggle with the trade-off between coverage and efficiency. Visual expert-assisted search is efficient but prone to blind spots when proposals fail, whereas scan-based search guarantees coverage at the cost of computational… ▽ More High-resolution (HR) image perception presents a key bottleneck for multimodal large language models (MLLMs). While visual search offers a promising solution, existing methods struggle with the trade-off between coverage and efficiency. Visual expert-assisted search is efficient but prone to blind spots when proposals fail, whereas scan-based search guarantees coverage at the cost of computational redundancy and semantic fragmentation. To address this dilemma, we introduce CVSearch, a training-free adaptive framework that dynamically schedules search strategies via an Assess-then-Search workflow. Specifically, CVSearch first invokes expert-assisted search when global information is insufficient, and only triggers a novel semantic-aware scanning mechanism upon failure. Distinct from rigid grid partitioning, this efficient scanning paradigm incorporates Semantic Guided Adaptive Patching to decompose images into semantically consistent regions, effectively mitigating object fragmentation. Furthermore, we devise a Dynamic Bottom-Up Search strategy driven by a Visual Complexity prior to enable efficient and precise iterative exploration of local details. Extensive experiments on HR benchmarks demonstrate that CVSearch achieves state-of-the-art accuracy while substantially improving search efficiency. Code is released at https://github.com/liliupeng28/ICML26-CVSearch. △ Less",2026
"One Policy, Infinite NPCs: Persona-Traceable Shared RL Policies for Scalable Game Agents","On a 300-persona life-simulation benchmark, pcsp achieves compositional zero-shot persona identification up to 17x above chance, Spearman rho approx 0.73 semantic-behavioral alignment, and 22x faster inference than an LLM-as-policy baseline. Life simulation games require hundreds to thousands of non-player characters (NPCs) that behave consistently with distinct personalities while remaining contr… ▽ More On a 300-persona life-simulation benchmark, pcsp achieves compositional zero-shot persona identification up to 17x above chance, Spearman rho approx 0.73 semantic-behavioral alignment, and 22x faster inference than an LLM-as-policy baseline. Life simulation games require hundreds to thousands of non-player characters (NPCs) that behave consistently with distinct personalities while remaining controllable through designer-authored natural language. Existing methods fail on constraints like persona consistency, controllability, or real-time inference. We introduce pcsp (Persona Conditioned Shared Policy), a single reinforcement learning policy conditioned on frozen LLM embeddings of free-form persona descriptions. pcsp combines once-per-NPC persona encoding, low-rank persona projection, neural persona conditioning, and a PPO + InfoNCE consistency + KL diversity training objective. Across three experimental settings, ablations show that the InfoNCE trajectory-consistency objective is load bearing: removing it collapses zero-shot persona identification to chance. External validation on Melting Pot 2.4.0 substrates confirms that our method produces persona-conditioned behavioral divergence in multi-agent strategic environments. We distinguish two senses of held-out evaluation: compositional zero-shot and vocabulary-expansion held-out. Finally, a UE5 deployment reproduces the in-engine persona-conditioning ablation at 64 agents with a low failure rate, showing that the sub-frame inference profile survives in a commercial game engine. These results prove that shared RL policies can support scalable, real-time, persona-conditioned NPC control. △ Less",2026
Diffusion Fluid Antenna Systems for Resilient ISAC,"…(DoF) that can reshape sensing signatures via port selection, beyond what waveform and power control alone can provide. In this paper, we devise diffusion FAS, a generative artificial intelligence (AI)-driven framework that exploits spatial agility to steer ISAC performance over the electromagnetic fading manifold. Ins… ▽ More Most existing integrated sensing and communication (ISAC) studies focus on enabling a base station (BS) to support sensing and communication over shared resources through advanced waveform design and power allocation. In contrast, the object-side perspective remains underexplored. For example, an object may wish to remain difficult to detect for security reasons, while another object in close proximity may generate dominant reflections that confuse the BS and impair sensing reliability for the intended target. These challenges motivate the fluid antenna system (FAS) paradigm which introduces a reconfigurable spatial degree of freedom (DoF) that can reshape sensing signatures via port selection, beyond what waveform and power control alone can provide. In this paper, we devise diffusion FAS, a generative artificial intelligence (AI)-driven framework that exploits spatial agility to steer ISAC performance over the electromagnetic fading manifold. Instead of optimizing ISAC solely in the power domain, diffusion FAS casts ISAC as a \emph{dynamic spatial selection} problem in which antenna states (i.e., ports) are chosen to shape sensing signatures while maintaining communication objectives. To work under sparse measurements, we employ a conditional denoising diffusion probabilistic model (DDPM) to reconstruct the latent spatial correlation structure from a small set of observed ports, enabling efficient exploration of the reconfigurable aperture. We demonstrate two FAS-enabled ISAC modes: (1) \emph{generative spatial stealth}, which identifies localized deep fades to suppress a target's sensing visibility by up to two orders of magnitude, and (2) \emph{target isolation}, which synthesizes spatial nulls that reject interference from adjacent objects. △ Less",2026
