Title,Summary,Year
Learning Through Noise: Why Subliminal Learning Works and When It Fails,"In the context of artificial neural networks, subliminal learning refers to the transfer of task-relevant knowledge or unintended biases from teacher to student models through distillation on task-unrelated input$\unicode{x2013}$output pairs. Prior explanations tie this effect to shared or closely matched teacher$\unicode{x2013}$student initialization. We sh… ▽ More In the context of artificial neural networks, subliminal learning refers to the transfer of task-relevant knowledge or unintended biases from teacher to student models through distillation on task-unrelated input$\unicode{x2013}$output pairs. Prior explanations tie this effect to shared or closely matched teacher$\unicode{x2013}$student initialization. We show that a closely matched initialization is not necessary. Instead, subliminal learning is governed by compatible output heads. Using a controlled MNIST setting, we split outputs into an auxiliary head (for auxiliary, task-unrelated noise signals) and a class head (for classification) to demonstrate subliminal learning occurs$\unicode{x2014}$even when we randomly initialize hidden layers and remove layers, add new layers, or change the architecture (MLP-to-CNN). Compatible auxiliary heads enable transfer of a recoverable teacher signal, bringing the student's representations closer to the teacher's. When the class heads remain compatible as well, students trained only on task-unrelated noise can approach, and in favorable regimes match, teacher-level task performance. Our setting enables us to develop a theory that explains the mechanism of subliminal learning and to derive upper bounds on when subliminal learning fails. Together, our results turn subliminal learning from a surprising transfer effect into a theoretically grounded mechanism with predictable limits. △ Less",2026
DualMem: Bypassing the Objectness Bottleneck for Calibrated Unknown-Stream Filtering in Open-World Object Detection,"Open-world object detection (OWOD) requires detectors to localize known classes while identifying unknown objects for future incremental learning. We find that the unknown prediction streams of strong OWOD detectors are heavily polluted: on M-OWODB, across PROB, OW-DETR, and HypOW, future-task positive unknowns make up less than 10% of unknown predictions, whereas background false positives accoun… ▽ More Open-world object detection (OWOD) requires detectors to localize known classes while identifying unknown objects for future incremental learning. We find that the unknown prediction streams of strong OWOD detectors are heavily polluted: on M-OWODB, across PROB, OW-DETR, and HypOW, future-task positive unknowns make up less than 10% of unknown predictions, whereas background false positives account for 46-71%. We show that this is not a missing-information problem, but an information bottleneck at the objectness head. On PROB Task 1, a linear probe on the 256-D decoder query achieves an AUROC of 0.908 for positive-versus-negative unknown discrimination, but the final one-dimensional objectness scalar drops to 0.642. A frozen SigLIP feature, without access to the detector, independently recovers much of this proposal-level separability at the filtering stage (AUROC = 0.871). Motivated by this finding, we propose DualMem, a calibrated post-hoc filter that assumes a small image-disjoint annotated calibration split of held-out future-task objects and performs a non-parametric likelihood ratio test in frozen SigLIP feature space. DualMem uses a k-nearest-neighbor positive memory to protect future-task objects and a negative memory to suppress background-like proposals. Its decision threshold is chosen by Neyman-Pearson calibration, giving users an explicit trade-off between false-unknown suppression and novel recall. Across PROB, OW-DETR, and HypOW on M-OWODB Task 1, DualMem reduces background-type false unknown proposals per image by 44.9%-66.3%, with a mean reduction of 56.6%. On PROB Task 1, it more than doubles the reduction achieved by a natural K-means prototype baseline, while leaving known-class mAP unchanged because known detections bypass the filter. △ Less",2026
Adversarial Vulnerability Under Temporal Concept Drift: A Longitudinal Study of Android Malware Detection,"…robustness loss under continued distributional evolution. These findings indicate that temporal drift should be considered when assessing the long-term robustness of intelligent detection systems under evolving data distributions and highlight the need for drift-aware robustness assessment frameworks in long-lived adversarial environments. ▽ More We present a longitudinal, drift-aware evaluation of adversarial robustness across more than a decade of Android applications using static and dynamic feature representations extracted from emulator and real-device executions. The dataset is organized into yearly slices and evaluated under three deployment protocols that emulate realistic learning scenarios: (1) same-year training and testing, (2) cross-year deployment without model updates, and (3) expanding-window retraining with cumulative historical data. Across multiple classifier families, adversarial examples are generated using FGSM and SPSA under feasibility constraints. We measure clean performance, Adversarial Accuracy (AA), Attack Success Rate (ASR), and introduce temporal linkage metrics -- RobustDrop, $Δ$ASR, and Adversarial Amplification Factor (AAF) -- to quantify the relationship between distribution shift and robustness degradation.nResults show that temporal separation is associated with reduced adversarial robustness under the evaluated transfer-based feature-space setting. As the train-test gap increases, clean accuracy and adversarial accuracy decline, while attack success exhibits configuration-dependent increases, particularly under FGSM perturbations and static features. Expanding-window retraining mitigates, but does not eliminate, robustness loss under continued distributional evolution. These findings indicate that temporal drift should be considered when assessing the long-term robustness of intelligent detection systems under evolving data distributions and highlight the need for drift-aware robustness assessment frameworks in long-lived adversarial environments. △ Less",2026
EM-Vid: Training-Free Entity-Centric Memory for Efficient and Consistent Multi-Shot Video Generation,"Multi-shot video generation requires maintaining a consistent appearance of recurring entities across shots while remaining faithful to shot-specific text prompts. Recent autoregressive methods reuse previously generated frames as memory. However, full-frame storage entangles persistent entity information with transient scene context, leading to irrelevant information leakage and high computationa… ▽ More Multi-shot video generation requires maintaining a consistent appearance of recurring entities across shots while remaining faithful to shot-specific text prompts. Recent autoregressive methods reuse previously generated frames as memory. However, full-frame storage entangles persistent entity information with transient scene context, leading to irrelevant information leakage and high computational cost. We propose an entity-centric memory in the form of an entity-indexed bank of latent patches. We introduce sparse token conditioning compatible with pretrained models, restricting self-attention to entity-relevant tokens and reducing computational cost. To support this, we introduce a structured multi-shot script format. We additionally propose a budgeted memory update strategy to maintain a compact, evolving memory. Finally, we equip the entity representation with a noise-injection mechanism that enables fine-grained appearance control, preventing leakage of irrelevant information. Our method improves prompt adherence and efficiency while preserving subject consistency. △ Less",2026
DiLaDiff: Distilled Latent-Augmented Diffusion for Language Modeling,"Diffusion language models intrinsically fail to capture correlations between decoded tokens, which leads to a harsh trade-off between sampling quality and throughput. To solve this issue, we propose DiLaDiff, a variant of masked diffusion language models with three components: (1) a continuous latent space with semantic capabilities, learned by an auto-encoder fine-tuned from an existing masked di… ▽ More Diffusion language models intrinsically fail to capture correlations between decoded tokens, which leads to a harsh trade-off between sampling quality and throughput. To solve this issue, we propose DiLaDiff, a variant of masked diffusion language models with three components: (1) a continuous latent space with semantic capabilities, learned by an auto-encoder fine-tuned from an existing masked diffusion language model; (2) a latent diffusion model learning the prior over the encoder distribution; (3) a consistency model distilling the learned prior into a few-step latent generative model. We show that, even without distillation, our latent-guided diffusion model outperforms the masked diffusion baseline while significantly accelerating inference. Consistency distillation further lowers the computational overhead of continuous diffusion, such that the latent is generated in negligible time compared to discrete decoding. △ Less",2026
Preisach Attention: A Hysteretic Model of Sequential Memory,"We introduce the Preisach Attention Layer (PAL), a novel sequence modelling architecture grounded in the classical Preisach hysteresis operator from mathematical physics. PAL replaces the softmax attention mechanism with a binary relay operator parameterised by learned activation and deactivation thresholds, maintaining a stack of local extrema as its internal state. A single-layer PAL-Transformer… ▽ More We introduce the Preisach Attention Layer (PAL), a novel sequence modelling architecture grounded in the classical Preisach hysteresis operator from mathematical physics. PAL replaces the softmax attention mechanism with a binary relay operator parameterised by learned activation and deactivation thresholds, maintaining a stack of local extrema as its internal state. A single-layer PAL-Transformer with O(1) depth is Turing-complete under arbitrary precision arithmetic, achievable through simulation of a two-stack pushdown automaton -- in contrast to the O(log n) depth required by standard hard-attention transformers. Second, we prove that the function classes computable by PAL and by the transformer are incomparable: PAL computes historical range statistics in O(1) layers that require O(log n) layers for transformers, while transformers support random-access retrieval that PAL cannot perform without auxiliary state. The separating property is rate-independence -- PAL responds only to the sequence of local extrema, not to absolute token positions or temporal spacing. Third, we show that the extremum stack constitutes a minimal sufficient statistic of the input history for all rate-independent functionals, providing a formal analogue of the wiping property in classical hysteresis theory. PAL is thus an efficient architecture for tasks with long episodic memory and weak positional dependence, with O(n log n) total inference cost versus O(n^2) for standard attention. △ Less",2026
Cost-Effective Model Evaluation with Meta-Learning,"The rapid growth of machine learning has produced an ever-expanding ecosystem of models, making it increasingly challenging to verify the reliability of newly released models on unseen, unlabeled data. Conventional evaluation pipelines depend on expensive annotation, repeated fine-tuning, or narrow assumptions that fail to transfer across model families. We present MetaEvaluator, a cost-effective,… ▽ More The rapid growth of machine learning has produced an ever-expanding ecosystem of models, making it increasingly challenging to verify the reliability of newly released models on unseen, unlabeled data. Conventional evaluation pipelines depend on expensive annotation, repeated fine-tuning, or narrow assumptions that fail to transfer across model families. We present MetaEvaluator, a cost-effective, model-agnostic framework for rapid, label-free assessment of unseen models spanning diverse architectures and modalities. MetaEvaluator leverages meta-learning over a pool of reference models to obtain a transferable initialization, enabling accurate evaluation of new models while amortizing cost across the pool and removing the need for per-model retraining. To the best of our knowledge, this is the first model-agnostic framework capable of evaluating new models on entirely unlabeled datasets. Extensive experiments show that MetaEvaluator produces stable and accurate performance estimates at substantially reduced cost compared to conventional approaches, making scalable benchmarking of emerging models on unlabeled data practical. △ Less",2026
Solving the Aircraft Disassembly Scheduling Problem,"Dismantling aircrafts reaching their end of life is a complex endeavour that is necessary in terms of sustainability but yields small income margins for air transport companies. An efficient scheduling of the disassembly procedure is thus crucial to ensure the profitability of the process and incentivize practice. This is a large scheduling problem that involves thousands of tasks and many differe… ▽ More Dismantling aircrafts reaching their end of life is a complex endeavour that is necessary in terms of sustainability but yields small income margins for air transport companies. An efficient scheduling of the disassembly procedure is thus crucial to ensure the profitability of the process and incentivize practice. This is a large scheduling problem that involves thousands of tasks and many different constraints: Extracting parts that are destined to be reused requires technicians with specific certifications and equipment. Extraction operations might be subject to precedence relations. Furthermore, the aircraft must be kept balanced during the whole process. Finally, some of the locations of the aircraft have a limited space that caps the number of technicians able to work there concurrently. This article presents the problem in details and proposes two approaches to solve the problem: a Constraint Programming model and a MIP model. The models are tested on instances of varying sizes involving up to 1450 tasks, which are based on real operational data provided by an industrial partner. △ Less",2026
Co-ReAct: Rubrics as Step-Level Collaborators for ReAct Agents,"ReAct-style agents for search-intensive, multi-step reasoning tasks rely largely on their own internal judgment to decide what evidence to seek, which reasoning or action step to take next, and when to stop, often producing shallow, redundant, or poorly targeted trajectories. Prior work has explored rubrics as external quality signals, but existing uses are mostly evaluative rather than action-gui… ▽ More ReAct-style agents for search-intensive, multi-step reasoning tasks rely largely on their own internal judgment to decide what evidence to seek, which reasoning or action step to take next, and when to stop, often producing shallow, redundant, or poorly targeted trajectories. Prior work has explored rubrics as external quality signals, but existing uses are mostly evaluative rather than action-guiding: rubrics typically serve as training-time rewards or post-hoc evaluators of completed outputs, and in deep-research settings they are often coarse-grained and report-level rather than step-level. We introduce Co-ReAct, a rubric-guided action-selection framework that uses rubrics as step-level guidance during inference. At each decision step, Co-ReAct injects a rubric into the agent's context to guide the next Reason-or-Act decision, specifying what the agent should target in evidence seeking, search, reasoning, or self-evaluation. To make this guidance reliable, we train a dedicated rubric generator with GRPO. Unlike prior pairwise or binary preference formulations, our objective optimizes a list-wise Spearman rank-correlation reward against multi-judge expert consensus rankings, encouraging rubrics that are discriminative rather than merely plausible. On DeepResearchBench and SQA-CS-V2, Co-ReAct consistently improves over ReAct and representative test-time compute baselines across search agents built on both 8B/14B open-source and frontier closed-source base models. The trained rubric generator can also serve as a drop-in component that improves these baselines without changing their underlying decision mechanisms. Our code is publicly available at https://github.com/ZBWpro/Co-ReAct. △ Less",2026
HARNESS-LM: A Three-Phase Training Recipe for Harnessing SLMs in Sponsored Search Retrieval,"In the competitive landscape of sponsored search, balancing retrieval quality with production latency is a critical challenge. While large retrieval models based on Small Language Models (SLMs) such as Qwen3-Embedding-4B/8B set strong upper bounds on public benchmarks, their deployment in high-throughput, latency-sensitive environments remains impractical. In this paper, we present HARNESS-LM (HLM… ▽ More In the competitive landscape of sponsored search, balancing retrieval quality with production latency is a critical challenge. While large retrieval models based on Small Language Models (SLMs) such as Qwen3-Embedding-4B/8B set strong upper bounds on public benchmarks, their deployment in high-throughput, latency-sensitive environments remains impractical. In this paper, we present HARNESS-LM (HLM), a three-phase training framework for transferring the capabilities of large-scale retrievers into compact, cost-efficient models. The approach comprises: (1) training a high-performance reference (""teacher"") retriever by fine-tuning a billion-parameter-scale SLM; (2) aligning query representations via an L2 objective to distill knowledge into a sub-600M parameter student encoder; and (3) applying a final contrastive refinement stage to optimize the student for retrieval performance. We also present a comprehensive empirical study of key design choices, including alignment objectives, embedding dimensionality, model scale, architecture, and optimization strategies, to identify configurations that are most effective in production settings. On a real-world Bing Ads evaluation benchmark, HLM recovers over 98% of the reference retriever's precision across multiple settings, while delivering up to 27x lower online query-encoder latency and 20x higher throughput on NVIDIA A100 GPUs. Online A/B testing on Bing Ads further shows a +1% Revenue, +0.6% Impression, and +0.4% Click uplift over the current ensemble of retrievers running in production with the deployed 190M parameter model, clearly highlighting the practical efficacy of the HLM recipe in a real-world sponsored search setting. △ Less",2026
CP or DP? Why Not Both: A Case Study in the Partial Shop Scheduling Problem,"Dynamic Programming (DP) and Constraint Programming (CP) are well-established paradigms for solving combinatorial optimization problems. Usually, these two approaches are used separately. This paper aims to show that the two can be combined effectively and elegantly, with DP serving as the primary search framework and CP used as a subroutine to leverage global constraint propagation. This paper pr… ▽ More Dynamic Programming (DP) and Constraint Programming (CP) are well-established paradigms for solving combinatorial optimization problems. Usually, these two approaches are used separately. This paper aims to show that the two can be combined effectively and elegantly, with DP serving as the primary search framework and CP used as a subroutine to leverage global constraint propagation. This paper presents such an approach for the Partial Shop Scheduling Problem (PSSP), for which a pure DP method has previously been proposed, and efficient CP filtering algorithms are available. The PSSP is a general scheduling problem where each job consists of a set of operations with arbitrary precedence constraints. The approach is flexible enough to accommodate anytime DP strategies, such as anytime column search, whereas the original DP algorithm operated in a strictly layer-wise manner. Moreover, the flexibility of the CP modeling makes it straightforward to incorporate arbitrary precedence constraints. As a result, the model naturally handles any precedence graph and even enables the design of a Large Neighborhood Search (LNS) scheme, in which the DP model is reused, and partial-order schedules are imposed across restarts to improve the incumbent solution. While not competitive with state-of-the-art pure CP solvers for this specific problem, our primary contribution is demonstrating the viability of this hybrid integration. △ Less",2026
Understanding Goal Generalisation in Sequential Reinforcement Learning,"Reinforcement learning agents often exhibit unintended goal-directed behaviour outside their training distribution, but we currently lack a principled understanding of how such agents will generalise to novel environments based on their training history. We address this gap for agents trained sequentially on one or more tasks. We study over 100 sequential training pipelines, evaluating behaviour a… ▽ More Reinforcement learning agents often exhibit unintended goal-directed behaviour outside their training distribution, but we currently lack a principled understanding of how such agents will generalise to novel environments based on their training history. We address this gap for agents trained sequentially on one or more tasks. We study over 100 sequential training pipelines, evaluating behaviour across over 250 out-of-distribution environments. We find that salient features drive generalisation, and that goals learnt early in training can persist and influence those acquired later. To explain these phenomena, we introduce latent policy gradients, a method that predicts what out-of-distribution behaviour a training pipeline will likely induce. Our method simulates the evolution of low-dimensional latent variables during training according to what would achieve high reward on the training objective with respect to a simple model of how the latent variables map to behaviour. It achieves strong predictive accuracy, generalises to unseen types of training pipeline, and is interpretable. Our findings demonstrate that while out-of-distribution RL agent behaviour is dependent on the whole training pipeline, this dependence has an underlying structure we can capture, laying groundwork for understanding goal generalisation from a developmental perspective. △ Less",2026
ARMS: Automatic Reward Shaping for Sparse-Reward Multi-Agent Reinforcement Learning,"Sparse rewards are a major bottleneck in multi-agent reinforcement learning (MARL), where simultaneous learning induces non-stationarity and makes reward design especially delicate. Reward shaping can accelerate learning, but in the multi-agent setting it must preserve the strategic structure of the problem rather than merely improve short-term optimization. We propose Automatic Reward-shaping in… ▽ More Sparse rewards are a major bottleneck in multi-agent reinforcement learning (MARL), where simultaneous learning induces non-stationarity and makes reward design especially delicate. Reward shaping can accelerate learning, but in the multi-agent setting it must preserve the strategic structure of the problem rather than merely improve short-term optimization. We propose Automatic Reward-shaping in Multi-agent Systems (ARMS), a self-supervised reward shaping framework for MARL that learns dense shaping signals from sparse environmental rewards through trajectory ranking. Since single-agent trajectory-ranking guarantees do not directly transfer to MARL, we reformulate policy invariance through conditional best-response reasoning, and show that if certain conditions hold, then using shaping rewards preserves each agent's best-response set under fixed opponent policies, and consequently preserve the set of Nash equilibria. Guided by this perspective, ARMS alternates between policy learning and reward learning while sharing shaping parameters across agents for efficiency. Experiments in a partially observable multi-agent pathfinding domain show that ARMS improves sampling efficiency under increasing reward sparsity and agent count, generalizes to unseen environments, and reveals a MARL-specific failure mode in which limited exploration and coupled policy--reward dynamics induce oscillatory behavior. Increasing exploration mitigates this effect and stabilizes learning. To the best of our knowledge, ARMS is the first automatic reward shaping framework for MARL whose design is motivated by a game-theoretic equilibrium-preservation result. △ Less",2026
