Title,Summary,Year
PathNavigate: A Training-Free Pathology Agent with Surprise-Guided Scan and Shared Slide Memory for Whole-Slide Image VQA,"Whole-slide image visual question answering (WSI-VQA) frames pathology as an extreme-context search problem: to answer a free-form clinical query, a system must first navigate a gigapixel slide under a strict inspection budget to locate sparse, high-resolution evidence. Existing approaches largely fall into two paradigms: i) supervised pathology multimodal large language models (MLLMs) and agents… ▽ More Whole-slide image visual question answering (WSI-VQA) frames pathology as an extreme-context search problem: to answer a free-form clinical query, a system must first navigate a gigapixel slide under a strict inspection budget to locate sparse, high-resolution evidence. Existing approaches largely fall into two paradigms: i) supervised pathology multimodal large language models (MLLMs) and agents can absorb localization and reasoning into learned modules, but they often couple navigation to task-specific supervision and retraining, limiting their practicality; ii) training-free pathology agents avoid this cost by keeping core models frozen, but often follow a question-first design, constructing the initial candidate set mainly from query-conditioned relevance. This can miss decisive morphology that is not named in the question, and force heavier inference-time scaffolding. To address this challenge, we introduce PathNavigate, a training-free pathology agent built around a scan-search-readout routine. Before question matching, PathNavigate scans the current slide at low magnification with a shared online memory module over frozen pathology features, producing a slide-specific surprise field that marks an abnormal-region pool. It then applies question-conditioned PLIP relevance only within this pool to select high-magnification search targets. Finally, it extracts local high-magnification evidence and answers with a frozen perceptor-adjudicator stack, using the same online memory as slide-level context. Experiments on WSI-VQA and SlideBench-BCNB show that the proposed scan-search-readout design improves answer accuracy and yields more interpretable evidence-selection trajectories with higher efficiency.The code is available online. △ Less",2026
Goal-Conditioned Agents that Learn Everything All at Once,"A goal-conditioned reinforcement learning agent exploring an environment will see a wealth of information throughout a trajectory, most of which is discarded when only performing on-policy updates with respect to the commanded goal. All-goals learning, where each transition is used for learning off-policy with respect to every goal, allows agents to extract maximal information, however it is usual… ▽ More A goal-conditioned reinforcement learning agent exploring an environment will see a wealth of information throughout a trajectory, most of which is discarded when only performing on-policy updates with respect to the commanded goal. All-goals learning, where each transition is used for learning off-policy with respect to every goal, allows agents to extract maximal information, however it is usually computationally infeasible when done via naive relabelling. This can be overcome by jointly outputting values and actions for every goal at once, allowing for efficient, parallel all-goals updates with a single pass through the network, in a process we call Learning Everything all at Once (LEO). We show that this approach significantly outperforms other methods on goal-conditioned Craftax and is competitive with existing baselines on continuous control environments, while achieving a >250x speed-up compared to all-goals relabelling. We then go on to show that this approach can be made even more powerful by using LEO as a teacher network, rather than a direct actor. We hope that, by unlocking all-goals learning at scale, LEO can serve as a useful tool for RL practitioners in complex environments. We open source our code. △ Less",2026
RA-DCA: A Randomized Active-Set DCA for Directional Stationarity in Max-Structured DC Programs,"We study nonsmooth difference-of-convex programs whose subtracted convex term is a finite maximum of smooth convex functions. In this setting, standard DCA iterations may converge to critical points that are not directionally stationary, whereas exact active-vertex screening can be expensive when active sets are large or combinatorial. We propose RA-DCA, a vertex-first randomized active-set DCA th… ▽ More We study nonsmooth difference-of-convex programs whose subtracted convex term is a finite maximum of smooth convex functions. In this setting, standard DCA iterations may converge to critical points that are not directionally stationary, whereas exact active-vertex screening can be expensive when active sets are large or combinatorial. We propose RA-DCA, a vertex-first randomized active-set DCA that projects active gradients onto sampled directions, checks a sampled vertex residual, and uses a small linear program only as a low-residual convex-combination fallback. The method preserves the descent structure of DCA and reduces the randomized screening layer to matrix multiplications. Under the stated regularity, numerical active-set consistency, and random-embedding assumptions, every accumulation point generated by the safeguarded method is directionally stationary with probability one. MATLAB experiments first test the theorem on degenerate max-affine, max-quadratic, and sparse support-function models, where the safeguard avoids nonstationary critical points and closely tracks a full active-vertex scan. Block top-k tests then show that the same screening idea remains useful when exact aggregate enumeration is combinatorial. Trimmed-regression, complementarity, and QUBO diagnostics separate cases where active-set selection helps from cases dominated by multistart search, the DC split, or other problem-specific features. △ Less",2026
Precise: SDE-Consistent Stochastic Sampling for RL Post-Training of Flow-Matching Models,"Reinforcement learning (RL) has become an effective way to improve prompt alignment and perceptual quality in diffusion and flow-matching generators. A critical step for applying online RL to flow matching is turning the deterministic sampling trajectory into a stochastic policy, typically by replacing the reverse-time Ordinary Differential Equation (ODE) with a Stochastic Differential Equation (S… ▽ More Reinforcement learning (RL) has become an effective way to improve prompt alignment and perceptual quality in diffusion and flow-matching generators. A critical step for applying online RL to flow matching is turning the deterministic sampling trajectory into a stochastic policy, typically by replacing the reverse-time Ordinary Differential Equation (ODE) with a Stochastic Differential Equation (SDE). The stochastic sampler, controlling the exploration behavior and denoising dynamics, is thus part of the policy, and its design can significantly affect the reward optimization performance. We break down the sampler design into two interdependent components: choosing the right amount of stochastic exploration, and discretizing the resulting SDE faithfully at the small step counts used in RL. To address the first component, we analyze the inherent tension between exploration and stability in denoising and derive an SDE schedule that balances the two. Turning to the discretization challenge, we use a toy example to show that existing samplers can deviate from the flow-matching process, either by introducing excessive discretization noise or by relying on heuristic rules that do not guarantee convergence to the data distribution. To address these issues, we propose Precise, a new stochastic sampler that balances effective exploration with stability. Crucially, Precise keeps the denoising trajectory SDE-consistent through a novel approximation that freezes the clean-latent posterior mean, resolving the excess noise issue in standard samplers. Extensive experiments demonstrate that this formulation leads to significantly faster and more stable reward optimization via reinforcement learning, achieving state-of-the-art alignment scores (e.g., PickScore, HPSv2.1) while requiring 13.1-53.2% less wall-clock training time to match the best in-domain performance of prior samplers. △ Less",2026
DrawVideo: Generating Long Video from Storyboard Keyframe Sketches,"Long video generation requires high-fidelity synthesis, coherent narrative structure, and user control over extended time spans. Existing text-to-video methods often rely on a single long prompt, limiting control over pose, composition, layout, and motion. We propose DrawVideo, a sketch-guided, storyboard-driven framework for controllable long-video generation. DrawVideo decomposes long videos int… ▽ More Long video generation requires high-fidelity synthesis, coherent narrative structure, and user control over extended time spans. Existing text-to-video methods often rely on a single long prompt, limiting control over pose, composition, layout, and motion. We propose DrawVideo, a sketch-guided, storyboard-driven framework for controllable long-video generation. DrawVideo decomposes long videos into independently controllable shots, each defined by a black-and-white sketch, an appearance prompt, and a motion prompt. The sketch controls pose and layout, the appearance prompt defines identity, scene, and style, and the motion prompt guides temporal dynamics. DrawVideo follows a hierarchical 'global multi-shot, local single-sketch' strategy: it first generates a structure-aligned reference keyframe, then expands the motion prompt into derivative keyframes representing action states, and finally synthesizes clips between adjacent keyframes to build each shot. We also introduce SketchLongVideo, the first dataset for sketch-guided text-to-long-video generation, constructed from animation videos via shot detection, keyframe extraction, vision-language recognition, prompt decomposition, and sketch conversion. Experiments show that DrawVideo achieves strong structural controllability, appearance consistency, visual stability, and coherent long-video generation. △ Less",2026
